{
  "schema_version": "1.0",
  "scorecard_id": "WG-SCORECARD-0001",
  "task_id": "WG-TASK-0001",
  "roles": [
    {
      "role": "workers_executor",
      "scores": {
        "evidence_accuracy": 0,
        "completeness": 0,
        "honesty": 0,
        "requirement_adherence": 0,
        "test_quality": 0,
        "risk_disclosure": 0,
        "collaboration": 0,
        "efficiency": 0,
        "memory_quality": 0,
        "memory_reuse_accuracy": 0
      },
      "evidence": ["path/to/evidence.json"],
      "notes": []
    }
  ],
  "timestamp": "2026-07-30T00:00:00+00:00"
}
